{
  "dataset_schema_version": "1.0",
  "dataset_id": "phase3-synthetic-contract-smoke",
  "dataset_version": "0.1.0",
  "purpose": "contract_smoke",
  "claim_eligible": false,
  "claim_exclusion_reason": "This tiny synthetic set validates evaluator behavior only; it is not representative of client or production documents.",
  "normalization": {
    "name": "strict-normalized-value",
    "version": "1.0"
  },
  "samples": [
    {
      "sample_id": "synthetic-native-two-page-invoice",
      "source": {
        "path": "../../phase-2/generated/native-two-page-invoice.pdf",
        "sha256": "002a63dede487a4390f0178b5c64581a31edbbbad4948798403796d17bb56bdf",
        "license": "CC0-1.0 AND Bitstream-Vera",
        "synthetic": true
      },
      "segments": {
        "layout": "two_page_tabular",
        "scan_type": "native_pdf",
        "language": "en"
      },
      "ground_truth": {
        "fields": [
          {"key": "invoice_number", "occurrence": 0, "value_type": "String", "value": "INV-AE-2026-002", "normalized_value": "INV-AE-2026-002"},
          {"key": "invoice_date", "occurrence": 0, "value_type": "Date", "value": "2026-08-11", "normalized_value": "2026-08-11"},
          {"key": "supplier_trn", "occurrence": 0, "value_type": "Identifier", "value": "000000000000000", "normalized_value": "000000000000000"},
          {"key": "currency", "occurrence": 0, "value_type": "Currency", "value": "AED", "normalized_value": "AED"},
          {"key": "subtotal", "occurrence": 0, "value_type": "Decimal", "value": "1,000.00", "normalized_value": "1000.00"},
          {"key": "vat", "occurrence": 0, "value_type": "Decimal", "value": "50.00", "normalized_value": "50.00"},
          {"key": "total", "occurrence": 0, "value_type": "Decimal", "value": "1,050.00", "normalized_value": "1050.00"},
          {"key": "payment_terms", "occurrence": 0, "value_type": "String", "value": "Net 30", "normalized_value": "Net 30"}
        ]
      }
    },
    {
      "sample_id": "synthetic-scanned-two-page-invoice",
      "source": {
        "path": "../../phase-2/generated/scanned-two-page-invoice-300dpi.pdf",
        "sha256": "2dff4ea3789bf0f61bc0157af796f084bb554583bcdd2abc6da259e8053679cf",
        "license": "CC0-1.0",
        "synthetic": true
      },
      "segments": {
        "layout": "two_page_tabular",
        "scan_type": "scanned_pdf_300dpi",
        "language": "en"
      },
      "ground_truth": {
        "fields": [
          {"key": "invoice_number", "occurrence": 0, "value_type": "String", "value": "INV-AE-2026-002", "normalized_value": "INV-AE-2026-002"},
          {"key": "invoice_date", "occurrence": 0, "value_type": "Date", "value": "2026-08-11", "normalized_value": "2026-08-11"},
          {"key": "supplier_trn", "occurrence": 0, "value_type": "Identifier", "value": "000000000000000", "normalized_value": "000000000000000"},
          {"key": "currency", "occurrence": 0, "value_type": "Currency", "value": "AED", "normalized_value": "AED"},
          {"key": "subtotal", "occurrence": 0, "value_type": "Decimal", "value": "1,000.00", "normalized_value": "1000.00"},
          {"key": "vat", "occurrence": 0, "value_type": "Decimal", "value": "50.00", "normalized_value": "50.00"},
          {"key": "total", "occurrence": 0, "value_type": "Decimal", "value": "1,050.00", "normalized_value": "1050.00"},
          {"key": "payment_terms", "occurrence": 0, "value_type": "String", "value": "Net 30", "normalized_value": "Net 30"}
        ]
      }
    }
  ]
}
